{
  "decklist_id": "riftdecks-regional-rebound-rq-las-vegas--best-of--draven",
  "event_id": "riftdecks-regional-rebound-rq-las-vegas",
  "player": "ItsJustSquid",
  "legend": "Draven, Glorious Executioner",
  "placement": "26",
  "is_best_of_legend": true,
  "cards": [
    {
      "card_id": "sfd-242-221",
      "card_code": "SFD-242",
      "count": 1,
      "name": "Glorious Executioner",
      "section": "mainboard"
    },
    {
      "card_id": "sfd-020-221",
      "card_code": "SFD-020",
      "count": 1,
      "name": "Draven, Vanquisher",
      "section": "mainboard"
    },
    {
      "card_id": "ogn-012-298",
      "card_code": "OGN-012",
      "count": 3,
      "name": "Noxus Hopeful",
      "section": "mainboard"
    },
    {
      "card_id": "ogn-027-298",
      "card_code": "OGN-027",
      "count": 3,
      "name": "Darius, Trifarian",
      "section": "mainboard"
    },
    {
      "card_id": "ogn-039-298",
      "card_code": "OGN-039",
      "count": 3,
      "name": "Kai'Sa, Survivor",
      "section": "mainboard"
    },
    {
      "card_id": "ogn-168-298",
      "card_code": "OGN-168",
      "count": 3,
      "name": "Fight or Flight",
      "section": "mainboard"
    },
    {
      "card_id": "ogn-183-298",
      "card_code": "OGN-183",
      "count": 3,
      "name": "Stacked Deck",
      "section": "mainboard"
    },
    {
      "card_id": "ogn-199-298",
      "card_code": "OGN-199",
      "count": 3,
      "name": "Tideturner",
      "section": "mainboard"
    },
    {
      "card_id": "sfd-128-221",
      "card_code": "SFD-128",
      "count": 3,
      "name": "Overzealous Fan",
      "section": "mainboard"
    },
    {
      "card_id": "sfd-130-221",
      "card_code": "SFD-130",
      "count": 3,
      "name": "Treasure Hunter",
      "section": "mainboard"
    },
    {
      "card_id": "sfd-186-221",
      "card_code": "SFD-186",
      "count": 3,
      "name": "Spinning Axe",
      "section": "mainboard"
    },
    {
      "card_id": "ogn-026-298",
      "card_code": "OGN-026",
      "count": 2,
      "name": "Brynhir Thundersong",
      "section": "mainboard"
    },
    {
      "card_id": "ogn-029-298",
      "card_code": "OGN-029",
      "count": 2,
      "name": "Falling Star",
      "section": "mainboard"
    },
    {
      "card_id": "ogn-172-298",
      "card_code": "OGN-172",
      "count": 2,
      "name": "Rebuke",
      "section": "mainboard"
    },
    {
      "card_id": "sfd-145-221",
      "card_code": "SFD-145",
      "count": 1,
      "name": "Switcheroo",
      "section": "mainboard"
    },
    {
      "card_id": "sfd-021-221",
      "card_code": "SFD-021",
      "count": 3,
      "name": "Ferrous Forerunner",
      "section": "mainboard"
    },
    {
      "card_id": "sfd-139-221",
      "card_code": "SFD-139",
      "count": 1,
      "name": "Edge of Night",
      "section": "mainboard"
    },
    {
      "card_id": "ogn-173-298",
      "card_code": "OGN-173",
      "count": 1,
      "name": "Ride the Wind",
      "section": "mainboard"
    },
    {
      "card_id": "ogn-284-298",
      "card_code": "OGN-284",
      "count": 1,
      "name": "Obelisk of Power",
      "section": "battlefields"
    },
    {
      "card_id": "ogn-285-298",
      "card_code": "OGN-285",
      "count": 1,
      "name": "Reaver's Row",
      "section": "battlefields"
    },
    {
      "card_id": "ogn-289-298",
      "card_code": "OGN-289",
      "count": 1,
      "name": "Targon's Peak",
      "section": "battlefields"
    },
    {
      "card_id": "ogn-007-298",
      "card_code": "OGN-007",
      "count": 6,
      "name": "Fury Rune",
      "section": "runes"
    },
    {
      "card_id": "ogn-166-298",
      "card_code": "OGN-166",
      "count": 6,
      "name": "Chaos Rune",
      "section": "runes"
    },
    {
      "card_id": "sfd-136-221",
      "card_code": "SFD-136",
      "count": 2,
      "name": "Hard Bargain",
      "section": "sideboard"
    },
    {
      "card_id": "ogn-192-298",
      "card_code": "OGN-192",
      "count": 2,
      "name": "Mindsplitter",
      "section": "sideboard"
    },
    {
      "card_id": "sfd-145-221",
      "card_code": "SFD-145",
      "count": 1,
      "name": "Switcheroo",
      "section": "sideboard"
    },
    {
      "card_id": "sfd-150-221",
      "card_code": "SFD-150",
      "count": 1,
      "name": "Last Rites",
      "section": "sideboard"
    },
    {
      "card_id": "sfd-023-221",
      "card_code": "SFD-023",
      "count": 1,
      "name": "Piercing Light",
      "section": "sideboard"
    },
    {
      "card_id": "ogn-022-298",
      "card_code": "OGN-022",
      "count": 1,
      "name": "Thermo Beam",
      "section": "sideboard"
    }
  ],
  "source": {
    "source_type": "trusted_secondary",
    "source_name": "RiftDecks Export TXT",
    "source_url": "https://riftdecks.com/decks/export/4ab89ddc-e66f-4537-9510-955146140b3c/txt",
    "source_date": null,
    "retrieved_at": "2026-04-26",
    "trust_tier": "trusted_secondary",
    "notes": "Imported from RiftDecks Export TXT as primary meta deck source."
  },
  "secondary_sources": [
    {
      "source_type": "trusted_secondary",
      "source_name": "RiftDecks deck page",
      "source_url": "https://riftdecks.com/riftbound-metagame/deck-vegas-rq-94927",
      "source_date": null,
      "retrieved_at": "2026-04-26",
      "trust_tier": "trusted_secondary"
    }
  ],
  "notes": "Best-of-legend import for Regional Rebound - RQ Las Vegas."
}
