{
  "decklist_id": "rq-hartford-2026--bol--kai-sa-daughter-of-the-void--flamekilla",
  "event_id": "rq-hartford-2026",
  "player": "Flamekilla",
  "legend": "Kai'Sa, Daughter of the Void",
  "placement": "best of legend",
  "is_best_of_legend": true,
  "source": {
    "source_type": "official",
    "source_name": "Riftbound official — Hartford Top Decks",
    "source_url": "https://riftbound.leagueoflegends.com/en-us/news/hartfords-top-decks/",
    "retrieved_at": "2026-06-24",
    "trust_tier": "official"
  },
  "cards": [
    {
      "card_id": "sfd-080-221",
      "count": 1,
      "name": "Bellows Breath",
      "section": "mainboard"
    },
    {
      "card_id": "ogn-029-298",
      "count": 3,
      "name": "Falling Star",
      "section": "mainboard"
    },
    {
      "card_id": "sfd-021-221",
      "count": 3,
      "name": "Ferrous Forerunner",
      "section": "mainboard"
    },
    {
      "card_id": "ogn-009-298",
      "count": 3,
      "name": "Hextech Ray",
      "section": "mainboard"
    },
    {
      "card_id": "ogn-087-298",
      "count": 3,
      "name": "Lecturing Yordle",
      "section": "mainboard"
    },
    {
      "card_id": "ogn-012-298",
      "count": 2,
      "name": "Noxus Hopeful",
      "section": "mainboard"
    },
    {
      "card_id": "sfd-023-221",
      "count": 1,
      "name": "Piercing Light",
      "section": "mainboard"
    },
    {
      "card_id": "unl-222-219",
      "count": 2,
      "name": "Plundering Poro",
      "section": "mainboard"
    },
    {
      "card_id": "ogn-103-298",
      "count": 2,
      "name": "Ravenbloom Student",
      "section": "mainboard"
    },
    {
      "card_id": "ogn-104-298",
      "count": 1,
      "name": "Retreat",
      "section": "mainboard"
    },
    {
      "card_id": "sfd-077-221",
      "count": 1,
      "name": "Rocket Barrage",
      "section": "mainboard"
    },
    {
      "card_id": "ogn-105-298",
      "count": 2,
      "name": "Singularity",
      "section": "mainboard"
    },
    {
      "card_id": "unl-007-219",
      "count": 1,
      "name": "Smite",
      "section": "mainboard"
    },
    {
      "card_id": "ogn-093-298",
      "count": 1,
      "name": "Smoke Screen",
      "section": "mainboard"
    },
    {
      "card_id": "ogn-095-298",
      "count": 3,
      "name": "Stupefy",
      "section": "mainboard"
    },
    {
      "card_id": "ogn-116-298",
      "count": 3,
      "name": "Thousand-Tailed Watcher",
      "section": "mainboard"
    },
    {
      "card_id": "ogn-122-298",
      "count": 2,
      "name": "Time Warp",
      "section": "mainboard"
    },
    {
      "card_id": "unl-070-219",
      "count": 1,
      "name": "Turn to Dust",
      "section": "mainboard"
    },
    {
      "card_id": "ogn-024-298",
      "count": 1,
      "name": "Void Seeker",
      "section": "mainboard"
    },
    {
      "card_id": "ogn-096-298",
      "count": 3,
      "name": "Watchful Sentry",
      "section": "mainboard"
    },
    {
      "card_id": "sfd-216-221",
      "count": 1,
      "name": "Rockfall Path",
      "section": "mainboard"
    },
    {
      "card_id": "ogn-290-298",
      "count": 1,
      "name": "The Arena's Greatest",
      "section": "mainboard"
    },
    {
      "card_id": "ogn-296-298",
      "count": 1,
      "name": "Void Gate",
      "section": "mainboard"
    },
    {
      "card_id": "ogn-007a-298",
      "count": 7,
      "name": "Fury Rune",
      "section": "mainboard"
    },
    {
      "card_id": "ogn-089-298",
      "count": 5,
      "name": "Mind Rune",
      "section": "mainboard"
    },
    {
      "card_id": "ogn-026-298",
      "count": 2,
      "name": "Brynhir Thundersong",
      "section": "sideboard"
    },
    {
      "card_id": "ogn-114-298",
      "count": 1,
      "name": "Progress Day",
      "section": "sideboard"
    },
    {
      "card_id": "unl-007-219",
      "count": 1,
      "name": "Smite",
      "section": "sideboard"
    },
    {
      "card_id": "ogn-022-298",
      "count": 2,
      "name": "Thermo Beam",
      "section": "sideboard"
    },
    {
      "card_id": "unl-070-219",
      "count": 1,
      "name": "Turn to Dust",
      "section": "sideboard"
    },
    {
      "card_id": "ogn-123-298",
      "count": 1,
      "name": "Unchecked Power",
      "section": "sideboard"
    }
  ]
}
