{
  "decklist_id": "rq-hartford-2026--bol--leona-radiant-dawn--clouds-king",
  "event_id": "rq-hartford-2026",
  "player": "Clouds King",
  "legend": "Leona, Radiant Dawn",
  "placement": "best of legend",
  "is_best_of_legend": true,
  "source": {
    "source_type": "official",
    "source_name": "Riftbound official — Hartford Top Decks",
    "source_url": "https://riftbound.leagueoflegends.com/en-us/news/hartfords-top-decks/",
    "retrieved_at": "2026-06-24",
    "trust_tier": "official"
  },
  "cards": [
    {
      "card_id": "unl-042-219",
      "count": 3,
      "name": "Back Off",
      "section": "mainboard"
    },
    {
      "card_id": "ogn-207-298",
      "count": 3,
      "name": "Call to Glory",
      "section": "mainboard"
    },
    {
      "card_id": "ogn-043-298",
      "count": 2,
      "name": "Charm",
      "section": "mainboard"
    },
    {
      "card_id": "ogn-045-298",
      "count": 3,
      "name": "Defy",
      "section": "mainboard"
    },
    {
      "card_id": "ogn-058-298",
      "count": 3,
      "name": "Discipline",
      "section": "mainboard"
    },
    {
      "card_id": "ogn-232-298",
      "count": 3,
      "name": "Fiora, Victorious",
      "section": "mainboard"
    },
    {
      "card_id": "sfd-052-221",
      "count": 1,
      "name": "Heart of Dark Ice",
      "section": "mainboard"
    },
    {
      "card_id": "ogn-213-298",
      "count": 1,
      "name": "Hidden Blade",
      "section": "mainboard"
    },
    {
      "card_id": "sfd-057a-221",
      "count": 2,
      "name": "Irelia, Fervent",
      "section": "mainboard"
    },
    {
      "card_id": "unl-221-219",
      "count": 3,
      "name": "Lonely Poro",
      "section": "mainboard"
    },
    {
      "card_id": "unl-052-219",
      "count": 3,
      "name": "Nami, Headstrong",
      "section": "mainboard"
    },
    {
      "card_id": "unl-053-219",
      "count": 2,
      "name": "Scuttle Crab",
      "section": "mainboard"
    },
    {
      "card_id": "ogn-052-298",
      "count": 3,
      "name": "Stalwart Poro",
      "section": "mainboard"
    },
    {
      "card_id": "unl-176-219",
      "count": 3,
      "name": "Vi, Peacekeeper",
      "section": "mainboard"
    },
    {
      "card_id": "ogn-262-298",
      "count": 2,
      "name": "Zenith Blade",
      "section": "mainboard"
    },
    {
      "card_id": "ogn-077-298",
      "count": 2,
      "name": "Zhonya's Hourglass",
      "section": "mainboard"
    },
    {
      "card_id": "ogn-282-298",
      "count": 1,
      "name": "Monastery of Hirana",
      "section": "mainboard"
    },
    {
      "card_id": "sfd-218-221",
      "count": 1,
      "name": "Sunken Temple",
      "section": "mainboard"
    },
    {
      "card_id": "ogn-290-298",
      "count": 1,
      "name": "The Arena's Greatest",
      "section": "mainboard"
    },
    {
      "card_id": "ogn-042-298",
      "count": 7,
      "name": "Calm Rune",
      "section": "mainboard"
    },
    {
      "card_id": "ogn-214a-298",
      "count": 5,
      "name": "Order Rune",
      "section": "mainboard"
    },
    {
      "card_id": "unl-169-219",
      "count": 2,
      "name": "Ashe, Focused",
      "section": "sideboard"
    },
    {
      "card_id": "sfd-032-221",
      "count": 2,
      "name": "Disarming Rake",
      "section": "sideboard"
    },
    {
      "card_id": "sfd-045-221",
      "count": 2,
      "name": "Not So Fast",
      "section": "sideboard"
    },
    {
      "card_id": "ogn-224-298",
      "count": 2,
      "name": "Salvage",
      "section": "sideboard"
    }
  ]
}
