{
  "decklist_id": "shenzhen-national-open-2026-03-22--irelia-blade-dancer-1",
  "event_id": "shenzhen-national-open-2026-03-22",
  "player": "阿门",
  "legend": "Irelia, Blade Dancer",
  "placement": 1,
  "is_best_of_legend": false,
  "cards": [],
  "source": {
    "source_type": "trusted_secondary",
    "source_name": "RiftDecks tournament deck page",
    "source_url": "https://riftdecks.com/riftbound-metagame/deck-dao-dao-de-mei-104992",
    "source_date": "2026-03-22",
    "retrieved_at": "2026-04-02",
    "trust_tier": "trusted_secondary",
    "notes": "Imported through locally accessible browser session after direct fetch was blocked by Cloudflare."
  },
  "secondary_sources": [],
  "notes": "Shenzhen National Open top 8 deck imported from trusted secondary coverage."
}
