{
  "decklist_id": "riftdecks-scg-con-atlanta-10k-constructed-riftbound--best-of--kaisa",
  "event_id": "riftdecks-scg-con-atlanta-10k-constructed-riftbound",
  "player": "George",
  "legend": "Kai'Sa, Daughter of the Void",
  "placement": "4",
  "is_best_of_legend": true,
  "cards": [
    {
      "card_id": "ogn-247-298",
      "card_code": "OGN-247",
      "count": 1,
      "name": "Daughter of the Void",
      "section": "mainboard"
    },
    {
      "card_id": "ogn-039-298",
      "card_code": "OGN-039",
      "count": 1,
      "name": "Kai'Sa, Survivor",
      "section": "mainboard"
    },
    {
      "card_id": "unl-220-219",
      "card_code": "UNL-220",
      "count": 3,
      "name": "Pouty Poro",
      "section": "mainboard"
    },
    {
      "card_id": "ogn-096-298",
      "card_code": "OGN-096",
      "count": 3,
      "name": "Watchful Sentry",
      "section": "mainboard"
    },
    {
      "card_id": "ogn-103-298",
      "card_code": "OGN-103",
      "count": 2,
      "name": "Ravenbloom Student",
      "section": "mainboard"
    },
    {
      "card_id": "ogn-012-298",
      "card_code": "OGN-012",
      "count": 3,
      "name": "Noxus Hopeful",
      "section": "mainboard"
    },
    {
      "card_id": "ogn-093-298",
      "card_code": "OGN-093",
      "count": 1,
      "name": "Smoke Screen",
      "section": "mainboard"
    },
    {
      "card_id": "ogn-024-298",
      "card_code": "OGN-024",
      "count": 2,
      "name": "Void Seeker",
      "section": "mainboard"
    },
    {
      "card_id": "ogn-122-298",
      "card_code": "OGN-122",
      "count": 2,
      "name": "Time Warp",
      "section": "mainboard"
    },
    {
      "card_id": "ogn-116-298",
      "card_code": "OGN-116",
      "count": 3,
      "name": "Thousand-Tailed Watcher",
      "section": "mainboard"
    },
    {
      "card_id": "ogn-027-298",
      "card_code": "OGN-027",
      "count": 3,
      "name": "Darius, Trifarian",
      "section": "mainboard"
    },
    {
      "card_id": "ogn-029-298",
      "card_code": "OGN-029",
      "count": 3,
      "name": "Falling Star",
      "section": "mainboard"
    },
    {
      "card_id": "ogn-095-298",
      "card_code": "OGN-095",
      "count": 3,
      "name": "Stupefy",
      "section": "mainboard"
    },
    {
      "card_id": "ogn-004-298",
      "card_code": "OGN-004",
      "count": 3,
      "name": "Cleave",
      "section": "mainboard"
    },
    {
      "card_id": "ogn-104-298",
      "card_code": "OGN-104",
      "count": 3,
      "name": "Retreat",
      "section": "mainboard"
    },
    {
      "card_id": "ogn-009-298",
      "card_code": "OGN-009",
      "count": 3,
      "name": "Hextech Ray",
      "section": "mainboard"
    },
    {
      "card_id": "ogn-248-298",
      "card_code": "OGN-248",
      "count": 1,
      "name": "Icathian Rain",
      "section": "mainboard"
    },
    {
      "card_id": "ogn-087-298",
      "card_code": "OGN-087",
      "count": 1,
      "name": "Lecturing Yordle",
      "section": "mainboard"
    },
    {
      "card_id": "ogn-280-298",
      "card_code": "OGN-280",
      "count": 1,
      "name": "Grove of the God-Willow",
      "section": "battlefields"
    },
    {
      "card_id": "ogn-285-298",
      "card_code": "OGN-285",
      "count": 1,
      "name": "Reaver's Row",
      "section": "battlefields"
    },
    {
      "card_id": "ogn-292-298",
      "card_code": "OGN-292",
      "count": 1,
      "name": "The Dreaming Tree",
      "section": "battlefields"
    },
    {
      "card_id": "ogn-007-298",
      "card_code": "OGN-007",
      "count": 7,
      "name": "Fury Rune",
      "section": "runes"
    },
    {
      "card_id": "ogn-089-298",
      "card_code": "OGN-089",
      "count": 5,
      "name": "Mind Rune",
      "section": "runes"
    },
    {
      "card_id": "ogn-022-298",
      "card_code": "OGN-022",
      "count": 3,
      "name": "Thermo Beam",
      "section": "sideboard"
    },
    {
      "card_id": "ogn-087-298",
      "card_code": "OGN-087",
      "count": 1,
      "name": "Lecturing Yordle",
      "section": "sideboard"
    },
    {
      "card_id": "ogn-088-298",
      "card_code": "OGN-088",
      "count": 2,
      "name": "Mega-Mech",
      "section": "sideboard"
    },
    {
      "card_id": "ogn-105-298",
      "card_code": "OGN-105",
      "count": 1,
      "name": "Singularity",
      "section": "sideboard"
    },
    {
      "card_id": "ogn-093-298",
      "card_code": "OGN-093",
      "count": 1,
      "name": "Smoke Screen",
      "section": "sideboard"
    }
  ],
  "source": {
    "source_type": "trusted_secondary",
    "source_name": "RiftDecks Export TXT",
    "source_url": "https://riftdecks.com/decks/export/782261c3-6bbe-4e35-a662-83283c693e44/txt",
    "source_date": null,
    "retrieved_at": "2026-04-26",
    "trust_tier": "trusted_secondary",
    "notes": "Imported from RiftDecks Export TXT as primary meta deck source."
  },
  "secondary_sources": [
    {
      "source_type": "trusted_secondary",
      "source_name": "RiftDecks deck page",
      "source_url": "https://riftdecks.com/riftbound-metagame/deck-george-sgc-con-atlanta-5k-80769",
      "source_date": null,
      "retrieved_at": "2026-04-26",
      "trust_tier": "trusted_secondary"
    }
  ],
  "notes": "Best-of-legend import for SCG CON Atlanta - $10K Constructed Riftbound."
}
