{
  "decklist_id": "riftdecks-friday-5k-pro-play-submit-orlando--best-of--leona",
  "event_id": "riftdecks-friday-5k-pro-play-submit-orlando",
  "player": "Moshe Acevedo",
  "legend": "Leona, Radiant Dawn",
  "placement": "78",
  "is_best_of_legend": true,
  "cards": [
    {
      "card_id": "ogn-261-298",
      "card_code": "OGN-261",
      "count": 1,
      "name": "Radiant Dawn",
      "section": "mainboard"
    },
    {
      "card_id": "ogn-238-298",
      "card_code": "OGN-238",
      "count": 1,
      "name": "Leona, Determined",
      "section": "mainboard"
    },
    {
      "card_id": "ogn-207-298",
      "card_code": "OGN-207",
      "count": 1,
      "name": "Call to Glory",
      "section": "mainboard"
    },
    {
      "card_id": "ogn-043-298",
      "card_code": "OGN-043",
      "count": 3,
      "name": "Charm",
      "section": "mainboard"
    },
    {
      "card_id": "ogn-045-298",
      "card_code": "OGN-045",
      "count": 3,
      "name": "Defy",
      "section": "mainboard"
    },
    {
      "card_id": "ogn-058-298",
      "card_code": "OGN-058",
      "count": 3,
      "name": "Discipline",
      "section": "mainboard"
    },
    {
      "card_id": "ogn-047-298",
      "card_code": "OGN-047",
      "count": 3,
      "name": "Find Your Center",
      "section": "mainboard"
    },
    {
      "card_id": "ogn-232-298",
      "card_code": "OGN-232",
      "count": 3,
      "name": "Fiora, Victorious",
      "section": "mainboard"
    },
    {
      "card_id": "ogn-238-298",
      "card_code": "OGN-238",
      "count": 2,
      "name": "Leona, Determined",
      "section": "mainboard"
    },
    {
      "card_id": "ogn-079-298",
      "card_code": "OGN-079",
      "count": 1,
      "name": "Leona, Zealot",
      "section": "mainboard"
    },
    {
      "card_id": "ogn-050-298",
      "card_code": "OGN-050",
      "count": 3,
      "name": "Rune Prison",
      "section": "mainboard"
    },
    {
      "card_id": "ogn-240-298",
      "card_code": "OGN-240",
      "count": 3,
      "name": "Sett, Kingpin",
      "section": "mainboard"
    },
    {
      "card_id": "ogn-051-298",
      "card_code": "OGN-051",
      "count": 3,
      "name": "Solari Shieldbearer",
      "section": "mainboard"
    },
    {
      "card_id": "ogn-075-298",
      "card_code": "OGN-075",
      "count": 3,
      "name": "Tasty Faefolk",
      "section": "mainboard"
    },
    {
      "card_id": "ogn-065-298",
      "card_code": "OGN-065",
      "count": 3,
      "name": "Wizened Elder",
      "section": "mainboard"
    },
    {
      "card_id": "ogn-262-298",
      "card_code": "OGN-262",
      "count": 2,
      "name": "Zenith Blade",
      "section": "mainboard"
    },
    {
      "card_id": "ogn-077-298",
      "card_code": "OGN-077",
      "count": 3,
      "name": "Zhonya's Hourglass",
      "section": "mainboard"
    },
    {
      "card_id": "ogn-282-298",
      "card_code": "OGN-282",
      "count": 1,
      "name": "Monastery of Hirana",
      "section": "battlefields"
    },
    {
      "card_id": "ogn-284-298",
      "card_code": "OGN-284",
      "count": 1,
      "name": "Obelisk of Power",
      "section": "battlefields"
    },
    {
      "card_id": "ogn-295-298",
      "card_code": "OGN-295",
      "count": 1,
      "name": "Vilemaw's Lair",
      "section": "battlefields"
    },
    {
      "card_id": "ogn-042-298",
      "card_code": "OGN-042",
      "count": 6,
      "name": "Calm Rune",
      "section": "runes"
    },
    {
      "card_id": "ogn-214-298",
      "card_code": "OGN-214",
      "count": 6,
      "name": "Order Rune",
      "section": "runes"
    },
    {
      "card_id": "ogn-067-298",
      "card_code": "OGN-067",
      "count": 2,
      "name": "Blitzcrank, Impassive",
      "section": "sideboard"
    },
    {
      "card_id": "ogn-224-298",
      "card_code": "OGN-224",
      "count": 3,
      "name": "Salvage",
      "section": "sideboard"
    },
    {
      "card_id": "ogn-063-298",
      "card_code": "OGN-063",
      "count": 3,
      "name": "Spirit's Refuge",
      "section": "sideboard"
    }
  ],
  "source": {
    "source_type": "trusted_secondary",
    "source_name": "RiftDecks Export TXT",
    "source_url": "https://riftdecks.com/decks/export/2bd27ad9-f5b7-4de9-82be-6eb60286bf2b/txt",
    "source_date": null,
    "retrieved_at": "2026-04-26",
    "trust_tier": "trusted_secondary",
    "notes": "Imported from RiftDecks Export TXT as primary meta deck source."
  },
  "secondary_sources": [
    {
      "source_type": "trusted_secondary",
      "source_name": "RiftDecks deck page",
      "source_url": "https://riftdecks.com/riftbound-metagame/deck-leona-radiant-dawn-32612",
      "source_date": null,
      "retrieved_at": "2026-04-26",
      "trust_tier": "trusted_secondary"
    }
  ],
  "notes": "Best-of-legend import for Friday $5k @ Pro Play Submit Orlando."
}
