{
  "decklist_id": "shanghai-national-open-2025-10-31--best-of--ahri",
  "event_id": "shanghai-national-open-2025-10-31",
  "player": "Stаnleny",
  "legend": "Ahri, Nine-Tailed Fox",
  "placement": "119",
  "is_best_of_legend": true,
  "cards": [
    {
      "card_id": "ogn-303-298",
      "card_code": "OGN-303",
      "count": 1,
      "name": "Nine-Tailed Fox",
      "section": "mainboard"
    },
    {
      "card_id": "sfd-227-221",
      "card_code": "SFD-227",
      "count": 1,
      "name": "Ahri, Inquisitive",
      "section": "mainboard"
    },
    {
      "card_id": "ogn-045-298",
      "card_code": "OGN-045",
      "count": 3,
      "name": "Defy",
      "section": "mainboard"
    },
    {
      "card_id": "ogn-043-298",
      "card_code": "OGN-043",
      "count": 3,
      "name": "Charm",
      "section": "mainboard"
    },
    {
      "card_id": "ogn-095-298",
      "card_code": "OGN-095",
      "count": 3,
      "name": "Stupefy",
      "section": "mainboard"
    },
    {
      "card_id": "ogn-058-298",
      "card_code": "OGN-058",
      "count": 3,
      "name": "Discipline",
      "section": "mainboard"
    },
    {
      "card_id": "ogn-103-298",
      "card_code": "OGN-103",
      "count": 3,
      "name": "Ravenbloom Student",
      "section": "mainboard"
    },
    {
      "card_id": "ogn-052-298",
      "card_code": "OGN-052",
      "count": 3,
      "name": "Stalwart Poro",
      "section": "mainboard"
    },
    {
      "card_id": "ogn-116-298",
      "card_code": "OGN-116",
      "count": 3,
      "name": "Thousand-Tailed Watcher",
      "section": "mainboard"
    },
    {
      "card_id": "ogn-087-298",
      "card_code": "OGN-087",
      "count": 3,
      "name": "Lecturing Yordle",
      "section": "mainboard"
    },
    {
      "card_id": "ogn-256-298",
      "card_code": "OGN-256",
      "count": 1,
      "name": "Fox-Fire",
      "section": "mainboard"
    },
    {
      "card_id": "ogn-075-298",
      "card_code": "OGN-075",
      "count": 2,
      "name": "Tasty Faefolk",
      "section": "mainboard"
    },
    {
      "card_id": "ogn-047-298",
      "card_code": "OGN-047",
      "count": 2,
      "name": "Find Your Center",
      "section": "mainboard"
    },
    {
      "card_id": "ogn-064-298",
      "card_code": "OGN-064",
      "count": 1,
      "name": "Wind Wall",
      "section": "mainboard"
    },
    {
      "card_id": "ogn-044-298",
      "card_code": "OGN-044",
      "count": 2,
      "name": "Clockwork Keeper",
      "section": "mainboard"
    },
    {
      "card_id": "ogn-122-298",
      "card_code": "OGN-122",
      "count": 1,
      "name": "Time Warp",
      "section": "mainboard"
    },
    {
      "card_id": "ogn-046-298",
      "card_code": "OGN-046",
      "count": 3,
      "name": "En Garde",
      "section": "mainboard"
    },
    {
      "card_id": "ogn-104-298",
      "card_code": "OGN-104",
      "count": 1,
      "name": "Retreat",
      "section": "mainboard"
    },
    {
      "card_id": "ogn-105-298",
      "card_code": "OGN-105",
      "count": 1,
      "name": "Singularity",
      "section": "mainboard"
    },
    {
      "card_id": "ogn-050-298",
      "card_code": "OGN-050",
      "count": 1,
      "name": "Rune Prison",
      "section": "mainboard"
    },
    {
      "card_id": "ogn-292-298",
      "card_code": "OGN-292",
      "count": 1,
      "name": "The Dreaming Tree",
      "section": "battlefields"
    },
    {
      "card_id": "ogn-294-298",
      "card_code": "OGN-294",
      "count": 1,
      "name": "Trifarian War Camp",
      "section": "battlefields"
    },
    {
      "card_id": "ogn-280-298",
      "card_code": "OGN-280",
      "count": 1,
      "name": "Grove of the God-Willow",
      "section": "battlefields"
    },
    {
      "card_id": "ogn-042-298",
      "card_code": "OGN-042",
      "count": 6,
      "name": "Calm Rune",
      "section": "runes"
    },
    {
      "card_id": "ogn-089-298",
      "card_code": "OGN-089",
      "count": 6,
      "name": "Mind Rune",
      "section": "runes"
    },
    {
      "card_id": "ogn-050-298",
      "card_code": "OGN-050",
      "count": 1,
      "name": "Rune Prison",
      "section": "sideboard"
    },
    {
      "card_id": "ogn-106-298",
      "card_code": "OGN-106",
      "count": 2,
      "name": "Sprite Mother",
      "section": "sideboard"
    },
    {
      "card_id": "ogn-088-298",
      "card_code": "OGN-088",
      "count": 2,
      "name": "Mega-Mech",
      "section": "sideboard"
    },
    {
      "card_id": "ogn-066-298",
      "card_code": "OGN-066",
      "count": 1,
      "name": "Ahri, Alluring",
      "section": "sideboard"
    },
    {
      "card_id": "ogn-122-298",
      "card_code": "OGN-122",
      "count": 1,
      "name": "Time Warp",
      "section": "sideboard"
    },
    {
      "card_id": "ogn-123-298",
      "card_code": "OGN-123",
      "count": 1,
      "name": "Unchecked Power",
      "section": "sideboard"
    }
  ],
  "source": {
    "source_type": "trusted_secondary",
    "source_name": "RiftDecks Export TXT",
    "source_url": "https://riftdecks.com/decks/export/a4032966-6e3a-4246-bfaf-18e55b737d97/txt",
    "source_date": null,
    "retrieved_at": "2026-04-26",
    "trust_tier": "trusted_secondary",
    "notes": "Imported from RiftDecks Export TXT as primary meta deck source."
  },
  "secondary_sources": [
    {
      "source_type": "trusted_secondary",
      "source_name": "RiftDecks deck page",
      "source_url": "https://riftdecks.com/riftbound-metagame/deck-bo3lan-li1031-487",
      "source_date": null,
      "retrieved_at": "2026-04-26",
      "trust_tier": "trusted_secondary"
    }
  ],
  "notes": "Best-of-legend import for Shanghai National Open."
}
