{
  "decklist_id": "best-lee-sin-from-bologna",
  "event_id": "rq-bologna",
  "player": "Boxingringxd",
  "legend": "Lee Sin",
  "placement": 162,
  "is_best_of_legend": false,
  "cards": [
    {
      "card_id": "ogn-132-298",
      "card_code": "OGN-132",
      "count": 3,
      "name": "First Mate",
      "section": "mainboard"
    },
    {
      "card_id": "sfd-057a-221",
      "card_code": "SFD-057",
      "count": 3,
      "name": "Irelia - Fervent",
      "section": "mainboard"
    },
    {
      "card_id": "sfd-036-221",
      "card_code": "SFD-036",
      "count": 3,
      "name": "Lonely Poro",
      "section": "mainboard"
    },
    {
      "card_id": "sfd-113-221",
      "card_code": "SFD-113",
      "count": 3,
      "name": "Lucian - Merciless",
      "section": "mainboard"
    },
    {
      "card_id": "ogn-052-298",
      "card_code": "OGN-052",
      "count": 3,
      "name": "Stalwart Poro",
      "section": "mainboard"
    },
    {
      "card_id": "ogn-128-298",
      "card_code": "OGN-128",
      "count": 3,
      "name": "Challenge",
      "section": "mainboard"
    },
    {
      "card_id": "ogn-043-298",
      "card_code": "OGN-043",
      "count": 2,
      "name": "Charm",
      "section": "mainboard"
    },
    {
      "card_id": "ogn-045-298",
      "card_code": "OGN-045",
      "count": 2,
      "name": "Defy",
      "section": "mainboard"
    },
    {
      "card_id": "ogn-058-298",
      "card_code": "OGN-058",
      "count": 3,
      "name": "Discipline",
      "section": "mainboard"
    },
    {
      "card_id": "sfd-043-221",
      "card_code": "SFD-043",
      "count": 1,
      "name": "Emperor's Divide",
      "section": "mainboard"
    },
    {
      "card_id": "ogn-046-298",
      "card_code": "OGN-046",
      "count": 2,
      "name": "En Garde",
      "section": "mainboard"
    },
    {
      "card_id": "sfd-045-221",
      "card_code": "SFD-045",
      "count": 2,
      "name": "Not So Fast",
      "section": "mainboard"
    },
    {
      "card_id": "ogn-154-298",
      "card_code": "OGN-154",
      "count": 1,
      "name": "Primal Strength",
      "section": "mainboard"
    },
    {
      "card_id": "sfd-097-221",
      "card_code": "SFD-097",
      "count": 3,
      "name": "Punch First",
      "section": "mainboard"
    },
    {
      "card_id": "sfd-095-221",
      "card_code": "SFD-095",
      "count": 2,
      "name": "Doran's Blade",
      "section": "mainboard"
    },
    {
      "card_id": "ogn-077-298",
      "card_code": "OGN-077",
      "count": 3,
      "name": "Zhonya's Hourglass",
      "section": "mainboard"
    },
    {
      "card_id": "ogn-126-298",
      "card_code": "OGN-126",
      "count": 7,
      "name": "Body Rune",
      "section": "mainboard"
    },
    {
      "card_id": "ogn-042-298",
      "card_code": "OGN-042",
      "count": 5,
      "name": "Calm Rune",
      "section": "mainboard"
    },
    {
      "card_id": "ogn-282-298",
      "card_code": "OGN-282",
      "count": 1,
      "name": "Monastery of Hirana",
      "section": "mainboard"
    },
    {
      "card_id": "sfd-218-221",
      "card_code": "SFD-218",
      "count": 1,
      "name": "Sunken Temple",
      "section": "mainboard"
    },
    {
      "card_id": "ogn-292-298",
      "card_code": "OGN-292",
      "count": 1,
      "name": "The Dreaming Tree",
      "section": "mainboard"
    },
    {
      "card_id": "ogn-045-298",
      "card_code": "OGN-045",
      "count": 1,
      "name": "Defy",
      "section": "sideboard"
    },
    {
      "card_id": "sfd-032-221",
      "card_code": "SFD-032",
      "count": 2,
      "name": "Disarming Rake",
      "section": "sideboard"
    },
    {
      "card_id": "ogn-046-298",
      "card_code": "OGN-046",
      "count": 1,
      "name": "En Garde",
      "section": "sideboard"
    },
    {
      "card_id": "sfd-105-221",
      "card_code": "SFD-105",
      "count": 2,
      "name": "Ruin Runner",
      "section": "sideboard"
    },
    {
      "card_id": "ogn-164-298",
      "card_code": "OGN-164",
      "count": 2,
      "name": "Sett - Brawler",
      "section": "sideboard"
    }
  ],
  "source": {
    "source_type": "official",
    "source_name": "Lee Sin official best-of decklist",
    "source_url": "https://riftbound.leagueoflegends.com/en-us/news/organizedplay/the-best-decks-out-of-bologna/",
    "source_date": "2026-02-25T17:00:00.000Z",
    "retrieved_at": "2026-04-02",
    "trust_tier": "official",
    "notes": "Decklist parsed directly from the official Riot/Riftbound event recap."
  },
  "secondary_sources": [
    {
      "source_type": "trusted_secondary",
      "source_name": "Lee Sin Riftbound.gg best-of deck",
      "source_url": "https://riftbound.gg/decks/best-lee-sin-from-bologna/",
      "source_date": null,
      "retrieved_at": "2026-04-02",
      "trust_tier": "trusted_secondary",
      "notes": "Trusted Riftbound.gg Best of Legend deck reference preserved as a secondary source."
    }
  ],
  "notes": "format=Spiritforged | views=7579 | mainboard=54 | sideboard=8"
}
