{
  "decklist_id": "rq-vegas-2026--bol--rek-sai-void-burrower--vouz",
  "event_id": "rq-vegas-2026",
  "player": "Vouz",
  "legend": "Rek'Sai, Void Burrower",
  "placement": "best of legend",
  "is_best_of_legend": true,
  "source": {
    "source_type": "official",
    "source_name": "Riftbound official — Las Vegas Top Decks",
    "source_url": "https://riftbound.leagueoflegends.com/en-us/news/organizedplay/vegas-top-decks",
    "retrieved_at": "2026-06-24",
    "trust_tier": "official"
  },
  "cards": [
    {
      "card_id": "sfd-170a-221",
      "count": 1,
      "name": "Rek'Sai, Swarm Queen",
      "section": "mainboard"
    },
    {
      "card_id": "sfd-012-221",
      "count": 3,
      "name": "Battering Ram",
      "section": "mainboard"
    },
    {
      "card_id": "ogn-207-298",
      "count": 1,
      "name": "Call to Glory",
      "section": "mainboard"
    },
    {
      "card_id": "unl-225-219",
      "count": 3,
      "name": "Daring Poro",
      "section": "mainboard"
    },
    {
      "card_id": "ogn-211-298",
      "count": 3,
      "name": "Faithful Manufactor",
      "section": "mainboard"
    },
    {
      "card_id": "ogn-213-298",
      "count": 3,
      "name": "Hidden Blade",
      "section": "mainboard"
    },
    {
      "card_id": "ogn-012-298",
      "count": 3,
      "name": "Noxus Hopeful",
      "section": "mainboard"
    },
    {
      "card_id": "sfd-166-221",
      "count": 2,
      "name": "Rally the Troops",
      "section": "mainboard"
    },
    {
      "card_id": "ogn-245-298",
      "count": 3,
      "name": "Seal of Unity",
      "section": "mainboard"
    },
    {
      "card_id": "ogn-217-298",
      "count": 3,
      "name": "Trifarian Gloryseeker",
      "section": "mainboard"
    },
    {
      "card_id": "sfd-159-221",
      "count": 2,
      "name": "Trusty Ramhound",
      "section": "mainboard"
    },
    {
      "card_id": "sfd-175-221",
      "count": 3,
      "name": "Undertitan",
      "section": "mainboard"
    },
    {
      "card_id": "ogn-218-298",
      "count": 3,
      "name": "Vanguard Captain",
      "section": "mainboard"
    },
    {
      "card_id": "sfd-010-221",
      "count": 3,
      "name": "Void Drone",
      "section": "mainboard"
    },
    {
      "card_id": "sfd-188-221",
      "count": 3,
      "name": "Void Rush",
      "section": "mainboard"
    },
    {
      "card_id": "sfd-176-221",
      "count": 1,
      "name": "Xin Zhao, Vigilant",
      "section": "mainboard"
    },
    {
      "card_id": "sfd-214-221",
      "count": 1,
      "name": "Power Nexus",
      "section": "mainboard"
    },
    {
      "card_id": "ogn-290-298",
      "count": 1,
      "name": "The Arena's Greatest",
      "section": "mainboard"
    },
    {
      "card_id": "ogn-294-298",
      "count": 1,
      "name": "Trifarian War Camp",
      "section": "mainboard"
    },
    {
      "card_id": "ogn-214a-298",
      "count": 12,
      "name": "Order Rune",
      "section": "mainboard"
    },
    {
      "card_id": "ogn-209-298",
      "count": 3,
      "name": "Cull the Weak",
      "section": "sideboard"
    },
    {
      "card_id": "ogn-212-298",
      "count": 3,
      "name": "Forge of the Future",
      "section": "sideboard"
    },
    {
      "card_id": "ogn-233-298",
      "count": 2,
      "name": "Grand Strategem",
      "section": "sideboard"
    }
  ]
}
