{
  "decklist_id": "riftdecks-jhm-cup-shanghai--best-of--darius",
  "event_id": "riftdecks-jhm-cup-shanghai",
  "player": "3",
  "legend": "Darius, Hand of Noxus",
  "placement": "61",
  "is_best_of_legend": true,
  "cards": [
    {
      "card_id": "ogn-253-298",
      "card_code": "OGN-253",
      "count": 1,
      "name": "Hand of Noxus",
      "section": "mainboard"
    },
    {
      "card_id": "ogn-027-298",
      "card_code": "OGN-027",
      "count": 1,
      "name": "Darius, Trifarian",
      "section": "mainboard"
    },
    {
      "card_id": "ogn-028-298",
      "card_code": "OGN-028",
      "count": 3,
      "name": "Draven, Showboat",
      "section": "mainboard"
    },
    {
      "card_id": "ogn-035-298",
      "card_code": "OGN-035",
      "count": 3,
      "name": "Vayne, Hunter",
      "section": "mainboard"
    },
    {
      "card_id": "unl-220-219",
      "card_code": "UNL-220",
      "count": 1,
      "name": "Pouty Poro",
      "section": "mainboard"
    },
    {
      "card_id": "ogn-016-298",
      "card_code": "OGN-016",
      "count": 1,
      "name": "Dangerous Duo",
      "section": "mainboard"
    },
    {
      "card_id": "ogn-245-298",
      "card_code": "OGN-245",
      "count": 3,
      "name": "Seal of Unity",
      "section": "mainboard"
    },
    {
      "card_id": "ogn-242-298",
      "card_code": "OGN-242",
      "count": 3,
      "name": "Baited Hook",
      "section": "mainboard"
    },
    {
      "card_id": "ogn-213-298",
      "card_code": "OGN-213",
      "count": 2,
      "name": "Hidden Blade",
      "section": "mainboard"
    },
    {
      "card_id": "ogn-233-298",
      "card_code": "OGN-233",
      "count": 2,
      "name": "Grand Strategem",
      "section": "mainboard"
    },
    {
      "card_id": "unl-225-219",
      "card_code": "UNL-225",
      "count": 2,
      "name": "Daring Poro",
      "section": "mainboard"
    },
    {
      "card_id": "ogn-211-298",
      "card_code": "OGN-211",
      "count": 3,
      "name": "Faithful Manufactor",
      "section": "mainboard"
    },
    {
      "card_id": "ogn-217-298",
      "card_code": "OGN-217",
      "count": 2,
      "name": "Trifarian Gloryseeker",
      "section": "mainboard"
    },
    {
      "card_id": "ogn-218-298",
      "card_code": "OGN-218",
      "count": 3,
      "name": "Vanguard Captain",
      "section": "mainboard"
    },
    {
      "card_id": "ogn-226-298",
      "card_code": "OGN-226",
      "count": 3,
      "name": "Spectral Matron",
      "section": "mainboard"
    },
    {
      "card_id": "ogn-012-298",
      "card_code": "OGN-012",
      "count": 2,
      "name": "Noxus Hopeful",
      "section": "mainboard"
    },
    {
      "card_id": "ogn-220-298",
      "card_code": "OGN-220",
      "count": 1,
      "name": "Facebreaker",
      "section": "mainboard"
    },
    {
      "card_id": "ogn-209-298",
      "card_code": "OGN-209",
      "count": 1,
      "name": "Cull the Weak",
      "section": "mainboard"
    },
    {
      "card_id": "ogn-004-298",
      "card_code": "OGN-004",
      "count": 2,
      "name": "Cleave",
      "section": "mainboard"
    },
    {
      "card_id": "ogn-039-298",
      "card_code": "OGN-039",
      "count": 1,
      "name": "Kai'Sa, Survivor",
      "section": "mainboard"
    },
    {
      "card_id": "ogn-216-298",
      "card_code": "OGN-216",
      "count": 1,
      "name": "Soaring Scout",
      "section": "mainboard"
    },
    {
      "card_id": "ogn-298-298",
      "card_code": "OGN-298",
      "count": 1,
      "name": "Zaun Warrens",
      "section": "battlefields"
    },
    {
      "card_id": "ogn-294-298",
      "card_code": "OGN-294",
      "count": 1,
      "name": "Trifarian War Camp",
      "section": "battlefields"
    },
    {
      "card_id": "ogn-291-298",
      "card_code": "OGN-291",
      "count": 1,
      "name": "The Candlelit Sanctum",
      "section": "battlefields"
    },
    {
      "card_id": "ogn-007-298",
      "card_code": "OGN-007",
      "count": 5,
      "name": "Fury Rune",
      "section": "runes"
    },
    {
      "card_id": "ogn-214-298",
      "card_code": "OGN-214",
      "count": 7,
      "name": "Order Rune",
      "section": "runes"
    },
    {
      "card_id": "ogn-221-298",
      "card_code": "OGN-221",
      "count": 1,
      "name": "Imperial Decree",
      "section": "sideboard"
    },
    {
      "card_id": "ogn-209-298",
      "card_code": "OGN-209",
      "count": 1,
      "name": "Cull the Weak",
      "section": "sideboard"
    },
    {
      "card_id": "ogn-224-298",
      "card_code": "OGN-224",
      "count": 2,
      "name": "Salvage",
      "section": "sideboard"
    },
    {
      "card_id": "ogn-213-298",
      "card_code": "OGN-213",
      "count": 1,
      "name": "Hidden Blade",
      "section": "sideboard"
    },
    {
      "card_id": "ogn-012-298",
      "card_code": "OGN-012",
      "count": 1,
      "name": "Noxus Hopeful",
      "section": "sideboard"
    },
    {
      "card_id": "ogn-036-298",
      "card_code": "OGN-036",
      "count": 1,
      "name": "Vi, Destructive",
      "section": "sideboard"
    },
    {
      "card_id": "ogn-021-298",
      "card_code": "OGN-021",
      "count": 1,
      "name": "Sun Disc",
      "section": "sideboard"
    }
  ],
  "source": {
    "source_type": "trusted_secondary",
    "source_name": "RiftDecks Export TXT",
    "source_url": "https://riftdecks.com/decks/export/bbe2be38-61f0-456a-9a8a-871dab6b1529/txt",
    "source_date": null,
    "retrieved_at": "2026-04-26",
    "trust_tier": "trusted_secondary",
    "notes": "Imported from RiftDecks Export TXT as primary meta deck source."
  },
  "secondary_sources": [
    {
      "source_type": "trusted_secondary",
      "source_name": "RiftDecks deck page",
      "source_url": "https://riftdecks.com/riftbound-metagame/deck-1-11921",
      "source_date": null,
      "retrieved_at": "2026-04-26",
      "trust_tier": "trusted_secondary"
    }
  ],
  "notes": "Best-of-legend import for JHM Cup Shanghai."
}
