{
  "decklist_id": "rq-utrecht-2026--bol--teemo-swift-scout--catl-kedjius",
  "event_id": "rq-utrecht-2026",
  "player": "CATL Kedjius",
  "legend": "Teemo, Swift Scout",
  "placement": "best of legend",
  "is_best_of_legend": true,
  "source": {
    "source_type": "official",
    "source_name": "Riftbound official — Utrecht Top Decks",
    "source_url": "https://riftbound.leagueoflegends.com/en-us/news/organizedplay/utrechts-top-decks/",
    "retrieved_at": "2026-06-24",
    "trust_tier": "official"
  },
  "cards": [
    {
      "card_id": "sfd-139-221",
      "count": 2,
      "name": "Edge of Night",
      "section": "mainboard"
    },
    {
      "card_id": "ogn-167-298",
      "count": 2,
      "name": "Ember Monk",
      "section": "mainboard"
    },
    {
      "card_id": "unl-141-219",
      "count": 2,
      "name": "Evelynn, Entrancing",
      "section": "mainboard"
    },
    {
      "card_id": "ogn-169-298",
      "count": 1,
      "name": "Gust",
      "section": "mainboard"
    },
    {
      "card_id": "unl-143a-219",
      "count": 3,
      "name": "Kha'Zix, Mutating Horror",
      "section": "mainboard"
    },
    {
      "card_id": "unl-145-219",
      "count": 2,
      "name": "Pyke, Returned",
      "section": "mainboard"
    },
    {
      "card_id": "ogn-103-298",
      "count": 3,
      "name": "Ravenbloom Student",
      "section": "mainboard"
    },
    {
      "card_id": "ogn-093-298",
      "count": 2,
      "name": "Smoke Screen",
      "section": "mainboard"
    },
    {
      "card_id": "unl-078-219",
      "count": 3,
      "name": "Sprite Fountain",
      "section": "mainboard"
    },
    {
      "card_id": "ogn-183-298",
      "count": 3,
      "name": "Stacked Deck",
      "section": "mainboard"
    },
    {
      "card_id": "unl-128-219",
      "count": 2,
      "name": "Star-Crossed",
      "section": "mainboard"
    },
    {
      "card_id": "ogn-095-298",
      "count": 3,
      "name": "Stupefy",
      "section": "mainboard"
    },
    {
      "card_id": "sfd-145-221",
      "count": 3,
      "name": "Switcheroo",
      "section": "mainboard"
    },
    {
      "card_id": "ogn-116-298",
      "count": 2,
      "name": "Thousand-Tailed Watcher",
      "section": "mainboard"
    },
    {
      "card_id": "ogn-199-298",
      "count": 3,
      "name": "Tideturner",
      "section": "mainboard"
    },
    {
      "card_id": "unl-150-219",
      "count": 3,
      "name": "Vex, Apathetic",
      "section": "mainboard"
    },
    {
      "card_id": "ogn-280-298",
      "count": 1,
      "name": "Grove of the God-Willow",
      "section": "mainboard"
    },
    {
      "card_id": "sfd-217-221",
      "count": 1,
      "name": "Seat of Power",
      "section": "mainboard"
    },
    {
      "card_id": "ogn-290-298",
      "count": 1,
      "name": "The Arena's Greatest",
      "section": "mainboard"
    },
    {
      "card_id": "ogn-166-298",
      "count": 6,
      "name": "Chaos Rune",
      "section": "mainboard"
    },
    {
      "card_id": "ogn-089-298",
      "count": 6,
      "name": "Mind Rune",
      "section": "mainboard"
    },
    {
      "card_id": "ogn-179-298",
      "count": 2,
      "name": "Acceptable Losses",
      "section": "sideboard"
    },
    {
      "card_id": "ogn-172-298",
      "count": 2,
      "name": "Rebuke",
      "section": "sideboard"
    },
    {
      "card_id": "ogn-105-298",
      "count": 2,
      "name": "Singularity",
      "section": "sideboard"
    },
    {
      "card_id": "unl-128-219",
      "count": 1,
      "name": "Star-Crossed",
      "section": "sideboard"
    },
    {
      "card_id": "unl-070-219",
      "count": 1,
      "name": "Turn to Dust",
      "section": "sideboard"
    }
  ]
}
