{
  "decklist_id": "vegas-regional-qualifier-kaisa-official-best-of",
  "event_id": "rq-vegas",
  "player": "aggresia",
  "legend": "Kai'Sa",
  "placement": 16,
  "is_best_of_legend": true,
  "cards": [
    {
      "card_id": "sfd-021-221",
      "card_code": "SFD-021",
      "count": 1,
      "name": "Ferrous Forerunner",
      "section": "mainboard"
    },
    {
      "card_id": "ogn-087-298",
      "card_code": "OGN-087",
      "count": 3,
      "name": "Lecturing Yordle",
      "section": "mainboard"
    },
    {
      "card_id": "ogn-012-298",
      "card_code": "OGN-012",
      "count": 2,
      "name": "Noxus Hopeful",
      "section": "mainboard"
    },
    {
      "card_id": "sfd-069-221",
      "card_code": "SFD-069",
      "count": 3,
      "name": "Plundering Poro",
      "section": "mainboard"
    },
    {
      "card_id": "ogn-013-298",
      "card_code": "OGN-013",
      "count": 1,
      "name": "Pouty Poro",
      "section": "mainboard"
    },
    {
      "card_id": "ogn-116-298",
      "card_code": "OGN-116",
      "count": 3,
      "name": "Thousand-Tailed Watcher",
      "section": "mainboard"
    },
    {
      "card_id": "ogn-096-298",
      "card_code": "OGN-096",
      "count": 3,
      "name": "Watchful Sentry",
      "section": "mainboard"
    },
    {
      "card_id": "sfd-080-221",
      "card_code": "SFD-080",
      "count": 2,
      "name": "Bellows Breath",
      "section": "mainboard"
    },
    {
      "card_id": "ogn-029-298",
      "card_code": "OGN-029",
      "count": 3,
      "name": "Falling Star",
      "section": "mainboard"
    },
    {
      "card_id": "ogn-009-298",
      "card_code": "OGN-009",
      "count": 3,
      "name": "Hextech Ray",
      "section": "mainboard"
    },
    {
      "card_id": "sfd-023-221",
      "card_code": "SFD-023",
      "count": 3,
      "name": "Piercing Light",
      "section": "mainboard"
    },
    {
      "card_id": "ogn-114-298",
      "card_code": "OGN-114",
      "count": 2,
      "name": "Progress Day",
      "section": "mainboard"
    },
    {
      "card_id": "sfd-077-221",
      "card_code": "SFD-077",
      "count": 2,
      "name": "Rocket Barrage",
      "section": "mainboard"
    },
    {
      "card_id": "ogn-105-298",
      "card_code": "OGN-105",
      "count": 3,
      "name": "Singularity",
      "section": "mainboard"
    },
    {
      "card_id": "ogn-095-298",
      "card_code": "OGN-095",
      "count": 3,
      "name": "Stupefy",
      "section": "mainboard"
    },
    {
      "card_id": "ogn-122-298",
      "card_code": "OGN-122",
      "count": 2,
      "name": "Time Warp",
      "section": "mainboard"
    },
    {
      "card_id": "ogn-007a-298",
      "card_code": "OGN-007",
      "count": 7,
      "name": "Fury Rune",
      "section": "mainboard"
    },
    {
      "card_id": "ogn-089-298",
      "card_code": "OGN-089",
      "count": 5,
      "name": "Mind Rune",
      "section": "mainboard"
    },
    {
      "card_id": "ogn-284-298",
      "card_code": "OGN-284",
      "count": 1,
      "name": "Obelisk of Power",
      "section": "mainboard"
    },
    {
      "card_id": "ogn-285-298",
      "card_code": "OGN-285",
      "count": 1,
      "name": "Reaver's Row",
      "section": "mainboard"
    },
    {
      "card_id": "ogn-296-298",
      "card_code": "OGN-296",
      "count": 1,
      "name": "Void Gate",
      "section": "mainboard"
    },
    {
      "card_id": "ogn-026-298",
      "card_code": "OGN-026",
      "count": 2,
      "name": "Brynhir Thundersong",
      "section": "sideboard"
    },
    {
      "card_id": "sfd-021-221",
      "card_code": "SFD-021",
      "count": 2,
      "name": "Ferrous Forerunner",
      "section": "sideboard"
    },
    {
      "card_id": "ogn-008-298",
      "card_code": "OGN-008",
      "count": 1,
      "name": "Get Excited!",
      "section": "sideboard"
    },
    {
      "card_id": "ogn-248-298",
      "card_code": "OGN-248",
      "count": 1,
      "name": "Icathian Rain",
      "section": "sideboard"
    },
    {
      "card_id": "ogn-022-298",
      "card_code": "OGN-022",
      "count": 2,
      "name": "Thermo Beam",
      "section": "sideboard"
    }
  ],
  "source": {
    "source_type": "official",
    "source_name": "Kai'Sa official best-of decklist",
    "source_url": "https://riftbound.leagueoflegends.com/en-us/news/organizedplay/vegas-top-decks/",
    "source_date": "2026-03-04T17:00:00.000Z",
    "retrieved_at": "2026-04-02",
    "trust_tier": "official",
    "notes": "Decklist parsed directly from the official Riot/Riftbound event recap."
  },
  "secondary_sources": [],
  "notes": "format=Spiritforged | views=0 | mainboard=54 | sideboard=8"
}
