{
  "decklist_id": "rq-hartford-2026--bol--irelia-blade-dancer--guubums",
  "event_id": "rq-hartford-2026",
  "player": "guubums",
  "legend": "Irelia, Blade Dancer",
  "placement": "best of legend",
  "is_best_of_legend": true,
  "source": {
    "source_type": "official",
    "source_name": "Riftbound official — Hartford Top Decks",
    "source_url": "https://riftbound.leagueoflegends.com/en-us/news/hartfords-top-decks/",
    "retrieved_at": "2026-06-24",
    "trust_tier": "official"
  },
  "cards": [
    {
      "card_id": "unl-131-219",
      "count": 1,
      "name": "Abandon",
      "section": "mainboard"
    },
    {
      "card_id": "sfd-133-221",
      "count": 3,
      "name": "Boots of Swiftness",
      "section": "mainboard"
    },
    {
      "card_id": "ogn-043-298",
      "count": 3,
      "name": "Charm",
      "section": "mainboard"
    },
    {
      "card_id": "sfd-196-221",
      "count": 3,
      "name": "Defiant Dance",
      "section": "mainboard"
    },
    {
      "card_id": "ogn-045-298",
      "count": 3,
      "name": "Defy",
      "section": "mainboard"
    },
    {
      "card_id": "ogn-058-298",
      "count": 3,
      "name": "Discipline",
      "section": "mainboard"
    },
    {
      "card_id": "ogn-046-298",
      "count": 2,
      "name": "En Garde",
      "section": "mainboard"
    },
    {
      "card_id": "sfd-051-221",
      "count": 2,
      "name": "Guardian Angel",
      "section": "mainboard"
    },
    {
      "card_id": "ogn-169-298",
      "count": 1,
      "name": "Gust",
      "section": "mainboard"
    },
    {
      "card_id": "unl-143a-219",
      "count": 2,
      "name": "Kha'Zix, Mutating Horror",
      "section": "mainboard"
    },
    {
      "card_id": "sfd-045-221",
      "count": 1,
      "name": "Not So Fast",
      "section": "mainboard"
    },
    {
      "card_id": "unl-145-219",
      "count": 2,
      "name": "Pyke, Returned",
      "section": "mainboard"
    },
    {
      "card_id": "ogn-173-298",
      "count": 2,
      "name": "Ride the Wind",
      "section": "mainboard"
    },
    {
      "card_id": "unl-053-219",
      "count": 3,
      "name": "Scuttle Crab",
      "section": "mainboard"
    },
    {
      "card_id": "unl-128-219",
      "count": 1,
      "name": "Star-Crossed",
      "section": "mainboard"
    },
    {
      "card_id": "sfd-048-221",
      "count": 2,
      "name": "Stellacorn Herder",
      "section": "mainboard"
    },
    {
      "card_id": "ogn-199-298",
      "count": 3,
      "name": "Tideturner",
      "section": "mainboard"
    },
    {
      "card_id": "unl-150-219",
      "count": 2,
      "name": "Vex, Apathetic",
      "section": "mainboard"
    },
    {
      "card_id": "unl-205-219",
      "count": 1,
      "name": "Abandoned Hall",
      "section": "mainboard"
    },
    {
      "card_id": "sfd-218-221",
      "count": 1,
      "name": "Sunken Temple",
      "section": "mainboard"
    },
    {
      "card_id": "ogn-289-298",
      "count": 1,
      "name": "Targon's Peak",
      "section": "mainboard"
    },
    {
      "card_id": "ogn-042-298",
      "count": 6,
      "name": "Calm Rune",
      "section": "mainboard"
    },
    {
      "card_id": "ogn-166-298",
      "count": 6,
      "name": "Chaos Rune",
      "section": "mainboard"
    },
    {
      "card_id": "ogn-056-298",
      "count": 3,
      "name": "Adaptatron",
      "section": "sideboard"
    },
    {
      "card_id": "ogn-169-298",
      "count": 1,
      "name": "Gust",
      "section": "sideboard"
    },
    {
      "card_id": "sfd-045-221",
      "count": 1,
      "name": "Not So Fast",
      "section": "sideboard"
    },
    {
      "card_id": "unl-128-219",
      "count": 1,
      "name": "Star-Crossed",
      "section": "sideboard"
    },
    {
      "card_id": "sfd-145-221",
      "count": 1,
      "name": "Switcheroo",
      "section": "sideboard"
    },
    {
      "card_id": "sfd-146-221",
      "count": 1,
      "name": "Vex, Cheerless",
      "section": "sideboard"
    }
  ]
}
