{
  "decklist_id": "rq-bologna-2026--bol--teemo-swift-scout--specimen",
  "event_id": "rq-bologna-2026",
  "player": "Specimen",
  "legend": "Teemo, Swift Scout",
  "placement": "best of legend",
  "is_best_of_legend": true,
  "source": {
    "source_type": "official",
    "source_name": "Riftbound official — Bologna Top Decks",
    "source_url": "https://riftbound.leagueoflegends.com/en-us/news/organizedplay/the-best-decks-out-of-bologna/",
    "retrieved_at": "2026-06-24",
    "trust_tier": "official"
  },
  "cards": [
    {
      "card_id": "ogn-197-298",
      "count": 1,
      "name": "Teemo, Scout",
      "section": "mainboard"
    },
    {
      "card_id": "sfd-122-221",
      "count": 3,
      "name": "Called Shot",
      "section": "mainboard"
    },
    {
      "card_id": "sfd-081-221",
      "count": 2,
      "name": "Card Sharp",
      "section": "mainboard"
    },
    {
      "card_id": "sfd-134-221",
      "count": 3,
      "name": "Cull",
      "section": "mainboard"
    },
    {
      "card_id": "sfd-072-221",
      "count": 3,
      "name": "Dropboarder",
      "section": "mainboard"
    },
    {
      "card_id": "sfd-139-221",
      "count": 3,
      "name": "Edge of Night",
      "section": "mainboard"
    },
    {
      "card_id": "sfd-149-221",
      "count": 3,
      "name": "Ezreal, Prodigy",
      "section": "mainboard"
    },
    {
      "card_id": "ogn-168-298",
      "count": 2,
      "name": "Fight or Flight",
      "section": "mainboard"
    },
    {
      "card_id": "ogn-194-298",
      "count": 3,
      "name": "Nocturne, Horrifying",
      "section": "mainboard"
    },
    {
      "card_id": "sfd-074-221",
      "count": 3,
      "name": "Pickpocket",
      "section": "mainboard"
    },
    {
      "card_id": "ogn-091-298",
      "count": 3,
      "name": "Pit Crew",
      "section": "mainboard"
    },
    {
      "card_id": "ogn-172-298",
      "count": 2,
      "name": "Rebuke",
      "section": "mainboard"
    },
    {
      "card_id": "ogn-204-298",
      "count": 3,
      "name": "Seal of Discord",
      "section": "mainboard"
    },
    {
      "card_id": "ogn-183-298",
      "count": 3,
      "name": "Stacked Deck",
      "section": "mainboard"
    },
    {
      "card_id": "sfd-145-221",
      "count": 1,
      "name": "Switcheroo",
      "section": "mainboard"
    },
    {
      "card_id": "ogn-116-298",
      "count": 2,
      "name": "Thousand-Tailed Watcher",
      "section": "mainboard"
    },
    {
      "card_id": "ogn-166-298",
      "count": 8,
      "name": "Chaos Rune",
      "section": "mainboard"
    },
    {
      "card_id": "ogn-089-298",
      "count": 4,
      "name": "Mind Rune",
      "section": "mainboard"
    },
    {
      "card_id": "sfd-214-221",
      "count": 1,
      "name": "Power Nexus",
      "section": "mainboard"
    },
    {
      "card_id": "ogn-290-298",
      "count": 1,
      "name": "The Arena's Greatest",
      "section": "mainboard"
    },
    {
      "card_id": "ogn-291-298",
      "count": 1,
      "name": "The Candlelit Sanctum",
      "section": "mainboard"
    },
    {
      "card_id": "sfd-135-221",
      "count": 2,
      "name": "Factory Recall",
      "section": "sideboard"
    },
    {
      "card_id": "ogn-168-298",
      "count": 1,
      "name": "Fight or Flight",
      "section": "sideboard"
    },
    {
      "card_id": "sfd-136-221",
      "count": 2,
      "name": "Hard Bargain",
      "section": "sideboard"
    },
    {
      "card_id": "sfd-145-221",
      "count": 1,
      "name": "Switcheroo",
      "section": "sideboard"
    },
    {
      "card_id": "ogn-199-298",
      "count": 2,
      "name": "Tideturner",
      "section": "sideboard"
    }
  ]
}
