{
  "decklist_id": "rq-vancouver-2026--bol--garen-might-of-demacia--swainy",
  "event_id": "rq-vancouver-2026",
  "player": "Swainy",
  "legend": "Garen, Might of Demacia",
  "placement": "best of legend",
  "is_best_of_legend": true,
  "source": {
    "source_type": "official",
    "source_name": "Riftbound official — Vancouver Top Decks",
    "source_url": "https://riftbound.leagueoflegends.com/en-us/news/organizedplay/vancouvers-top-decks/",
    "retrieved_at": "2026-06-24",
    "trust_tier": "official"
  },
  "cards": [
    {
      "card_id": "ogs-013-024",
      "count": 1,
      "name": "Garen, Commander",
      "section": "mainboard"
    },
    {
      "card_id": "sfd-169-221",
      "count": 2,
      "name": "Altar of Memories",
      "section": "mainboard"
    },
    {
      "card_id": "ogn-138-298",
      "count": 3,
      "name": "Catalyst of Aeons",
      "section": "mainboard"
    },
    {
      "card_id": "sfd-179-221",
      "count": 2,
      "name": "Corina Veraza",
      "section": "mainboard"
    },
    {
      "card_id": "ogn-160-298",
      "count": 3,
      "name": "Dazzling Aurora",
      "section": "mainboard"
    },
    {
      "card_id": "unl-118a-219",
      "count": 3,
      "name": "Elder Dragon",
      "section": "mainboard"
    },
    {
      "card_id": "ogn-133-298",
      "count": 3,
      "name": "Flurry of Blades",
      "section": "mainboard"
    },
    {
      "card_id": "ogn-212-298",
      "count": 3,
      "name": "Forge of the Future",
      "section": "mainboard"
    },
    {
      "card_id": "sfd-154-221",
      "count": 2,
      "name": "Guards!",
      "section": "mainboard"
    },
    {
      "card_id": "ogn-134-298",
      "count": 3,
      "name": "Mobilize",
      "section": "mainboard"
    },
    {
      "card_id": "sfd-166-221",
      "count": 1,
      "name": "Rally the Troops",
      "section": "mainboard"
    },
    {
      "card_id": "ogs-015-024",
      "count": 2,
      "name": "Recruit the Vanguard",
      "section": "mainboard"
    },
    {
      "card_id": "unl-106-219",
      "count": 3,
      "name": "Repulse",
      "section": "mainboard"
    },
    {
      "card_id": "ogn-156-298",
      "count": 2,
      "name": "Sabotage",
      "section": "mainboard"
    },
    {
      "card_id": "unl-165-219",
      "count": 2,
      "name": "Shadow's Call",
      "section": "mainboard"
    },
    {
      "card_id": "unl-175-219",
      "count": 2,
      "name": "Tactical Retreat",
      "section": "mainboard"
    },
    {
      "card_id": "sfd-168-221",
      "count": 2,
      "name": "Vanguard Armory",
      "section": "mainboard"
    },
    {
      "card_id": "ogn-229-298",
      "count": 1,
      "name": "Vengeance",
      "section": "mainboard"
    },
    {
      "card_id": "ogn-276-298",
      "count": 1,
      "name": "Aspirant's Climb",
      "section": "mainboard"
    },
    {
      "card_id": "sfd-209-221",
      "count": 1,
      "name": "Forgotten Monument",
      "section": "mainboard"
    },
    {
      "card_id": "sfd-219-221",
      "count": 1,
      "name": "The Papertree",
      "section": "mainboard"
    },
    {
      "card_id": "ogn-126-298",
      "count": 7,
      "name": "Body Rune",
      "section": "mainboard"
    },
    {
      "card_id": "ogn-214a-298",
      "count": 5,
      "name": "Order Rune",
      "section": "mainboard"
    },
    {
      "card_id": "sfd-109-221",
      "count": 2,
      "name": "Akshan, Mischievous",
      "section": "sideboard"
    },
    {
      "card_id": "ogn-148-298",
      "count": 1,
      "name": "Anivia, Primal",
      "section": "sideboard"
    },
    {
      "card_id": "ogn-224-298",
      "count": 2,
      "name": "Salvage",
      "section": "sideboard"
    },
    {
      "card_id": "sfd-120a-221",
      "count": 1,
      "name": "Sivir, Ambitious",
      "section": "sideboard"
    },
    {
      "card_id": "ogn-145-298",
      "count": 2,
      "name": "Unyielding Spirit",
      "section": "sideboard"
    }
  ]
}
