{
  "decklist_id": "riftdecks-super-saturday-standard-challenge-rq-lille-saturday-11am--best-of--viktor",
  "event_id": "riftdecks-super-saturday-standard-challenge-rq-lille-saturday-11am",
  "player": "Guillem M",
  "legend": "Viktor, Herald of the Arcane",
  "placement": "1",
  "is_best_of_legend": true,
  "cards": [
    {
      "card_id": "ogn-308-298",
      "card_code": "OGN-308",
      "count": 1,
      "name": "Herald of the Arcane",
      "section": "mainboard"
    },
    {
      "card_id": "ogn-000-298",
      "card_code": "OGN-000",
      "count": 1,
      "name": "Viktor, Leader",
      "section": "mainboard"
    },
    {
      "card_id": "ogn-095-298",
      "card_code": "OGN-095",
      "count": 3,
      "name": "Stupefy",
      "section": "mainboard"
    },
    {
      "card_id": "ogn-116-298",
      "card_code": "OGN-116",
      "count": 3,
      "name": "Thousand-Tailed Watcher",
      "section": "mainboard"
    },
    {
      "card_id": "ogn-209-298",
      "card_code": "OGN-209",
      "count": 3,
      "name": "Cull the Weak",
      "section": "mainboard"
    },
    {
      "card_id": "ogn-213-298",
      "card_code": "OGN-213",
      "count": 3,
      "name": "Hidden Blade",
      "section": "mainboard"
    },
    {
      "card_id": "sfd-155-221",
      "card_code": "SFD-155",
      "count": 3,
      "name": "Honest Broker",
      "section": "mainboard"
    },
    {
      "card_id": "sfd-176-221",
      "card_code": "SFD-176",
      "count": 3,
      "name": "Xin Zhao, Vigilant",
      "section": "mainboard"
    },
    {
      "card_id": "ogn-105-298",
      "card_code": "OGN-105",
      "count": 2,
      "name": "Singularity",
      "section": "mainboard"
    },
    {
      "card_id": "ogn-224-298",
      "card_code": "OGN-224",
      "count": 1,
      "name": "Salvage",
      "section": "mainboard"
    },
    {
      "card_id": "ogn-221-298",
      "card_code": "OGN-221",
      "count": 2,
      "name": "Imperial Decree",
      "section": "mainboard"
    },
    {
      "card_id": "sfd-070-221",
      "card_code": "SFD-070",
      "count": 3,
      "name": "Wages of Pain",
      "section": "mainboard"
    },
    {
      "card_id": "sfd-165-221",
      "card_code": "SFD-165",
      "count": 1,
      "name": "Glasc Mixologist",
      "section": "mainboard"
    },
    {
      "card_id": "sfd-080-221",
      "card_code": "SFD-080",
      "count": 3,
      "name": "Bellows Breath",
      "section": "mainboard"
    },
    {
      "card_id": "sfd-081-221",
      "card_code": "SFD-081",
      "count": 1,
      "name": "Card Sharp",
      "section": "mainboard"
    },
    {
      "card_id": "ogn-218-298",
      "card_code": "OGN-218",
      "count": 3,
      "name": "Vanguard Captain",
      "section": "mainboard"
    },
    {
      "card_id": "ogn-207-298",
      "card_code": "OGN-207",
      "count": 1,
      "name": "Call to Glory",
      "section": "mainboard"
    },
    {
      "card_id": "ogn-245-298",
      "card_code": "OGN-245",
      "count": 1,
      "name": "Seal of Unity",
      "section": "mainboard"
    },
    {
      "card_id": "sfd-166-221",
      "card_code": "SFD-166",
      "count": 3,
      "name": "Rally the Troops",
      "section": "mainboard"
    },
    {
      "card_id": "ogn-295-298",
      "card_code": "OGN-295",
      "count": 1,
      "name": "Vilemaw's Lair",
      "section": "battlefields"
    },
    {
      "card_id": "ogn-294-298",
      "card_code": "OGN-294",
      "count": 1,
      "name": "Trifarian War Camp",
      "section": "battlefields"
    },
    {
      "card_id": "ogn-290-298",
      "card_code": "OGN-290",
      "count": 1,
      "name": "The Arena's Greatest",
      "section": "battlefields"
    },
    {
      "card_id": "ogn-214-298",
      "card_code": "OGN-214",
      "count": 6,
      "name": "Order Rune",
      "section": "runes"
    },
    {
      "card_id": "ogn-089-298",
      "card_code": "OGN-089",
      "count": 6,
      "name": "Mind Rune",
      "section": "runes"
    },
    {
      "card_id": "ogn-224-298",
      "card_code": "OGN-224",
      "count": 2,
      "name": "Salvage",
      "section": "sideboard"
    },
    {
      "card_id": "ogn-226-298",
      "card_code": "OGN-226",
      "count": 2,
      "name": "Spectral Matron",
      "section": "sideboard"
    },
    {
      "card_id": "sfd-161-221",
      "card_code": "SFD-161",
      "count": 1,
      "name": "B.F. Sword",
      "section": "sideboard"
    },
    {
      "card_id": "ogn-221-298",
      "card_code": "OGN-221",
      "count": 1,
      "name": "Imperial Decree",
      "section": "sideboard"
    },
    {
      "card_id": "ogn-087-298",
      "card_code": "OGN-087",
      "count": 1,
      "name": "Lecturing Yordle",
      "section": "sideboard"
    },
    {
      "card_id": "ogn-220-298",
      "card_code": "OGN-220",
      "count": 1,
      "name": "Facebreaker",
      "section": "sideboard"
    }
  ],
  "source": {
    "source_type": "trusted_secondary",
    "source_name": "RiftDecks Export TXT",
    "source_url": "https://riftdecks.com/decks/export/9f17c00c-51c6-408d-abb7-1e47a62938e2/txt",
    "source_date": null,
    "retrieved_at": "2026-04-26",
    "trust_tier": "trusted_secondary",
    "notes": "Imported from RiftDecks Export TXT as primary meta deck source."
  },
  "secondary_sources": [
    {
      "source_type": "trusted_secondary",
      "source_name": "RiftDecks deck page",
      "source_url": "https://riftdecks.com/riftbound-metagame/deck-viktor-herald-of-the-arcane-113175",
      "source_date": null,
      "retrieved_at": "2026-04-26",
      "trust_tier": "trusted_secondary"
    }
  ],
  "notes": "Best-of-legend import for Super Saturday Standard Challenge - RQ Lille Saturday 11am."
}
