{
  "decklist_id": "rq-vegas-2026--bol--lucian-purifier--daemonxgg",
  "event_id": "rq-vegas-2026",
  "player": "DaemonXGG",
  "legend": "Lucian, Purifier",
  "placement": "best of legend",
  "is_best_of_legend": true,
  "source": {
    "source_type": "official",
    "source_name": "Riftbound official — Las Vegas Top Decks",
    "source_url": "https://riftbound.leagueoflegends.com/en-us/news/organizedplay/vegas-top-decks",
    "retrieved_at": "2026-06-24",
    "trust_tier": "official"
  },
  "cards": [
    {
      "card_id": "sfd-113a-221",
      "count": 1,
      "name": "Lucian, Merciless",
      "section": "mainboard"
    },
    {
      "card_id": "sfd-109-221",
      "count": 1,
      "name": "Akshan, Mischievous",
      "section": "mainboard"
    },
    {
      "card_id": "sfd-118-221",
      "count": 2,
      "name": "Boneshiver",
      "section": "mainboard"
    },
    {
      "card_id": "ogn-026-298",
      "count": 2,
      "name": "Brynhir Thundersong",
      "section": "mainboard"
    },
    {
      "card_id": "ogn-128-298",
      "count": 3,
      "name": "Challenge",
      "section": "mainboard"
    },
    {
      "card_id": "sfd-095-221",
      "count": 3,
      "name": "Doran's Blade",
      "section": "mainboard"
    },
    {
      "card_id": "ogn-132-298",
      "count": 3,
      "name": "First Mate",
      "section": "mainboard"
    },
    {
      "card_id": "ogn-039-298",
      "count": 3,
      "name": "Kai'Sa, Survivor",
      "section": "mainboard"
    },
    {
      "card_id": "sfd-022-221",
      "count": 2,
      "name": "Long Sword",
      "section": "mainboard"
    },
    {
      "card_id": "sfd-113a-221",
      "count": 2,
      "name": "Lucian, Merciless",
      "section": "mainboard"
    },
    {
      "card_id": "sfd-023-221",
      "count": 3,
      "name": "Piercing Light",
      "section": "mainboard"
    },
    {
      "card_id": "sfd-097-221",
      "count": 3,
      "name": "Punch First",
      "section": "mainboard"
    },
    {
      "card_id": "sfd-184-221",
      "count": 3,
      "name": "Relentless Pursuit",
      "section": "mainboard"
    },
    {
      "card_id": "sfd-105-221",
      "count": 3,
      "name": "Ruin Runner",
      "section": "mainboard"
    },
    {
      "card_id": "ogn-156-298",
      "count": 1,
      "name": "Sabotage",
      "section": "mainboard"
    },
    {
      "card_id": "sfd-030-221",
      "count": 2,
      "name": "Skyfall of Areion",
      "section": "mainboard"
    },
    {
      "card_id": "sfd-115-221",
      "count": 3,
      "name": "Trinity Force",
      "section": "mainboard"
    },
    {
      "card_id": "sfd-208-221",
      "count": 1,
      "name": "Forge of the Fluft",
      "section": "mainboard"
    },
    {
      "card_id": "ogn-284-298",
      "count": 1,
      "name": "Obelisk of Power",
      "section": "mainboard"
    },
    {
      "card_id": "sfd-218-221",
      "count": 1,
      "name": "Sunken Temple",
      "section": "mainboard"
    },
    {
      "card_id": "ogn-126-298",
      "count": 7,
      "name": "Body Rune",
      "section": "mainboard"
    },
    {
      "card_id": "ogn-007a-298",
      "count": 5,
      "name": "Fury Rune",
      "section": "mainboard"
    },
    {
      "card_id": "sfd-109-221",
      "count": 1,
      "name": "Akshan, Mischievous",
      "section": "sideboard"
    },
    {
      "card_id": "sfd-011-221",
      "count": 2,
      "name": "Angle Shot",
      "section": "sideboard"
    },
    {
      "card_id": "ogn-026-298",
      "count": 1,
      "name": "Brynhir Thundersong",
      "section": "sideboard"
    },
    {
      "card_id": "sfd-021-221",
      "count": 2,
      "name": "Ferrous Forerunner",
      "section": "sideboard"
    },
    {
      "card_id": "ogn-156-298",
      "count": 2,
      "name": "Sabotage",
      "section": "sideboard"
    }
  ]
}
